[
  {
    "slug": "use-meta-muse-effectively",
    "title": "How to use Meta Muse effectively",
    "category": "AI + Automation",
    "description": "Get useful work done with Muse: clear task briefs, a complete worked example, copyable prompts, and Nic’s referral code WA1RM4.",
    "body": "Get one useful job finished with Meta's Muse: research a purchase, prepare a document, or turn a messy week into a workable plan. Start with a small task, give it clear limits, and check the result before adding more responsibility.\n\n**Your first result:** a three-option buying shortlist with source links, a recommendation, and a clear explanation of what still needs checking. The worked example below uses a fictional shopper looking for a work headset under $120. Replace those details with a task you actually need done.\n\n## 1. Join Muse and redeem Nic's code\n\nUse **Join Muse** above to open muse.ai/join. Choose the web or app option offered for your device, create your account, and check the access requirements shown during signup.\n\n**Nic's referral invite:** “Check out Muse, your personal AI agent. Redeem my code in Settings within 48 hours of joining and we'll both get 1 billion Muse tokens.”\n\n**Referral code: WA1RM4**\n\nCopy the code below into Muse's referral redemption field in **Settings**, within 48 hours of joining. This code goes in Settings, not into a conversation.\n\n```prompt\nWA1RM4\n```\n\nThis is Nic's referral code, and Nic also receives tokens for a qualifying redemption. The offer above comes from Nic's invite; check the current offer and eligibility in Muse before redeeming. This guide has not independently verified the code's remaining availability or the promotion's full terms. Confirm the reward in your account after redemption.\n\nYou can download this complete guide and every prompt using **Download guide + prompts (.txt)** above. Save it before you start so you can reuse the briefs later.\n\n## 2. Set up for one small win\n\nMeta describes Muse as a personal agent that can use a browser and connected apps, create files, and continue working on tasks in the background. What it can actually complete depends on your access, permissions, and the services involved. Ask it to state any limitation rather than quietly replacing real work with guesses.\n\nFor your first session, choose public research with a clear finish line. You do not need to connect your inbox to compare products. Open Muse and start with a short task brief. If a needed connection is unavailable, supply the relevant text or links and keep the final action manual.\n\nBefore connecting an account, review what Muse is asking to access. Use Muse's sign-in and permission flow when a task needs it. Check the privacy and model-training choices in Settings and choose the options you want. A written prompt sets your intent; use the actual permission controls as well.\n\n**Good first tasks:** compare three products, turn supplied notes into a checklist, draft a weekly plan, or prepare a document from material you provide. Pick one deliverable you can inspect in a few minutes.\n\n## 3. Give Muse a complete brief\n\nA useful brief answers six questions: **What should be finished? What context matters? What may it use? What are the limits? What should the result look like? When should it stop?**\n\nCopy this into Muse and replace every bracket. Name the actual document, date, budget, and timezone when they matter. Ask only for access that the job needs.\n\n```prompt\nHelp me complete this task: [specific finished result].\nContext: [who this is for, why it matters, and relevant background].\nInputs: [paste notes, links, or name the files I supplied].\nUse: [public websites, supplied material, or named connected apps].\nLimits: [budget and currency, date range, location, must-haves, and exclusions].\nDeliverable: [a shortlist, checklist, document, spreadsheet, or draft], including [required fields].\n\nAsk up to three questions only if the missing answers would materially change the result. Otherwise state reasonable assumptions and begin. Tell me if you cannot access an input or perform a requested action.\n\nStart with a brief plan. Research and prepare the deliverable, but ask before sending messages, purchasing, booking, publishing, deleting, or changing my accounts. Stop when the deliverable is ready for review. Include source links where relevant, unresolved questions, and a summary of what you actually did.\n```\n\nRead the plan before extending access. If the brief asks for five products and the plan proposes a month of price monitoring, narrow it back to the original job.\n\n## 4. Run a complete example\n\n**Fictional starting brief:** you need a new headset for laptop calls in a shared home office. Your limit is $120 USD including shipping and tax. Comfort, a clear microphone, and a USB connection matter more than gaming features.\n\nPaste this into Muse. Replace the location and computer details before running it. The product results must come from current research; the example does not assume any specific headset is in stock.\n\n```prompt\nFind three new headsets for work calls that are likely to fit a $120 USD total budget, including shipping and tax.\nMy location: [country and ZIP/postal code].\nMy computer and ports: [operating system and available USB ports].\nUse case: two hours of video calls daily in a shared home office.\nMust-haves: a boom microphone, comfortable over-ear fit, and compatibility with my computer. Wired USB is fine. Exclude refurbished products.\n\nUse current manufacturer specifications and retailer listings. For each option, give the exact model, connection type, compatibility evidence, listed price, shipping if visible, whether tax is included or still unknown, return-policy link, and product links. Separate manufacturer claims from independently checked evidence. Do not infer microphone quality from marketing language alone.\n\nRecommend one option and explain the main tradeoff. If the full delivered cost cannot be verified, label it provisional. Stop after three viable options, or explain why fewer qualify. Do not sign in, add to a cart, contact a seller, or purchase anything. Return a compact comparison and your recommendation.\n```\n\n**What a usable result contains:** three identifiable models, working links, evidence for the required connection and compatibility, a price breakdown, and an honest note about unknown tax or shipping. A polished paragraph without those details is unfinished.\n\nOpen the recommended product link yourself. Confirm the model and variant match, the price is current, and the return policy applies to your location. If a $109 headset has unverified shipping and tax, it is still provisional against a $120 total limit.\n\n### Improve the result with one precise correction\n\nKeep the good research and change the part that missed your needs. If the shortlist has Bluetooth-only options, specify the correction instead of restarting the whole task.\n\n```prompt\nRevise the headset shortlist you just made. Keep every option that meets my original requirements. Remove Bluetooth-only options because I need a direct USB connection. Replace only the removed options, using current source links. Recheck the total-cost uncertainty against my $120 USD cap. Show what changed and why. Keep the task research-only and stop after the updated shortlist.\n```\n\n### Turn research into something reusable\n\nOnce the facts are checked, ask for a file you can keep. Muse's documentation describes creating documents, PDFs, web pages, and other artifacts. Request the format you need and verify that the returned file actually opens.\n\n```prompt\nTurn the checked headset shortlist from this conversation into a one-page buying brief. Include my requirements, the recommended exact model, the comparison, source links, prices with the date checked, and unresolved costs or compatibility questions. Preserve uncertainty and do not add new factual claims. Create a downloadable PDF if available; otherwise return a clean document I can copy and save. Stop when it is ready. Do not purchase or schedule anything.\n```\n\nThe finished result is a brief you can open, understand, and use to make your own purchase decision. This is a suggested workflow checked against documentation, not a report of a purchase tested by Nic.Buildz.\n\n## 5. Use the same structure for everyday work\n\nThese three prompts are starting points. Replace the brackets, inspect the first result, and then decide whether a connection or recurring task would help.\n\n### Turn a task list into a realistic week\n\nPaste your tasks and existing commitments into Muse. The first pass can work from supplied text. Only connect a calendar if you want Muse to read it and you have reviewed that access.\n\n```prompt\nBuild a practical plan for the week starting [date] in [timezone].\nTasks with deadlines: [list].\nExisting commitments: [list].\nAvailable work hours: [hours by day].\nMy top priority: [priority].\n\nChoose three outcomes, estimate the time each needs, and place work into the available gaps with buffer time. Flag conflicts and tasks that will not fit. Return a day-by-day proposal. If you cannot read my calendar, use only the commitments supplied here and say so. Do not create or move calendar events. Stop with the proposed plan for me to review.\n```\n\nCheck deadlines and available hours before accepting the plan. If it assumes six free hours on a day with two, correct that input first.\n\n### Prepare replies without losing the important details\n\nProvide the relevant message text, or use a connected inbox you have deliberately approved. Check that Muse distinguishes a requested action from an action already completed.\n\n```prompt\nHelp me process [the messages pasted below / this specific connected inbox folder] for [date range].\nMy priorities: [priorities].\n\nReturn the five most important items with sender, subject, requested actio